<!ELEMENT nouveautes (#PCDATA | description)*>
<!ELEMENT description (#PCDATA | fabricant | produit | prix)*>
<!ELEMENT fabricant (#PCDATA)>
<!ELEMENT produit (#PCDATA)>
<!ELEMENT prix (#PCDATA)>

